{
  "schema_version": "tscb.source-onboarding.v2",
  "source_artifact_id": "v2:source-artifact:sha256:d95cce7dd1a9bb1bcabd51525e3bcc719db89cade6c09e16ab1aef3821c673a0",
  "repository": "https://github.com/fast-pack/MaskedVByte",
  "commit": "e2298b7a28002e08f3f74755353b7229bfe6475b",
  "dirty": false,
  "submodules": [],
  "implementation_files": [
    "adapters/maskedvbyte/vendor/MaskedVByte/src/varintencode.c",
    "adapters/maskedvbyte/vendor/MaskedVByte/src/varintdecode.c"
  ],
  "public_api_files": [
    "adapters/maskedvbyte/vendor/MaskedVByte/include/varintencode.h",
    "adapters/maskedvbyte/vendor/MaskedVByte/include/varintdecode.h"
  ],
  "benchmark_files": [
    "adapters/maskedvbyte/vendor/MaskedVByte/examples/example.c"
  ],
  "test_files": [
    "adapters/maskedvbyte/vendor/MaskedVByte/tests/unit.c",
    "adapters/maskedvbyte/tests/source_guard.c",
    "adapters/maskedvbyte/tests/abi_qualification.c",
    "tests/adapters/test_maskedvbyte.py"
  ],
  "license_files": [
    "adapters/maskedvbyte/vendor/MaskedVByte/LICENSE"
  ],
  "third_party_dependencies": [],
  "object_level_candidates": [
    "P0_PRIMITIVE"
  ],
  "input_contract": {
    "dtype": "<u4",
    "shape": "CONTIGUOUS_VECTOR",
    "ownership": "BORROWED_IMMUTABLE",
    "max_count": 16777216,
    "alignment_bytes": 1,
    "external_padding_bytes": 0
  },
  "output_contract": {
    "kind": "TSCB_MVB1_UINT32_PLAIN_CHECKED_DESCRIPTOR_V1",
    "self_contained": true,
    "capacity_is_not_size": true,
    "descriptor_sha256": true,
    "native_frame_checksum": "FNV1A64"
  },
  "lifecycle_contract": {
    "update": "ONCE",
    "finalize": "MANDATORY_ZERO_BYTES",
    "reset": "MODE_ZERO_ONLY",
    "output_bound": "44 + descriptor bytes + 40 + 5*N; actual length may be shorter",
    "return_length": "tscb_buffer_v1.used_bytes is exact; capacity is not size",
    "error_codes": {
      "0": "OK",
      "1": "INVALID_ARGUMENT",
      "2": "UNSUPPORTED",
      "3": "DST_TOO_SMALL",
      "4": "CODEC_ERROR",
      "5": "FINALIZE_REQUIRED",
      "6": "ABI_MISMATCH"
    },
    "decoder_apis": [
      "COUNT",
      "COMPRESSED_SIZE"
    ],
    "starting_point": "ZERO_ONLY",
    "stage_execution": "ORIGINAL_PLAIN_LEB128"
  },
  "stream_components": [
    "descriptor",
    "sha256",
    "native_magic",
    "count",
    "seed",
    "coding",
    "reserved",
    "payload_length",
    "original_leb128",
    "fnv64"
  ],
  "upstream_tests": [
    {
      "name": "source_matrix_original_failure_retained",
      "status": "PASS",
      "log_sha256": "2996ac566bf1a287d69764ad58a85c5e70ca36814fe222a36e034d2e498cb96d",
      "evidence": "build/source-audits/maskedvbyte-source-both-tests.json"
    },
    {
      "name": "bounded_native",
      "status": "PASS",
      "log_sha256": "1aa15dd851003dd8beb2eb02d1d0706662a87a2d203ede62da866d7bcc79da68",
      "evidence": "build/source-audits/maskedvbyte-native-tests.json"
    },
    {
      "name": "direct_sdk",
      "status": "PASS",
      "log_sha256": "814fa765d24d7780706fbdd9fdb80ce818f4c05492c90a0ef53c8e32e0d75eed",
      "evidence": "build/source-audits/maskedvbyte-sdk-v3-20261009-06/report.json"
    }
  ],
  "builds": [
    {
      "kind": "release",
      "artifact_sha256": "1912d7c40198b7db36b6b56aea6edb072cdf5d7c67b3d50ca52c20520e80cc7c",
      "compile_commands_sha256": "4d8b3bfac9621b30cfa79c21582f348d5bf2e7db3c6c9b7597de87f5c5229bd0"
    },
    {
      "kind": "debug",
      "artifact_sha256": "264e45beb8d6682e92985fda5924b3bfd724d9fb604839126f34d53573c2a114",
      "compile_commands_sha256": "179030a6d324660a6730f7653795e126cb4728303e58ed32eb2f55eaec772969"
    },
    {
      "kind": "sanitizer",
      "artifact_sha256": "820435443ccc2fff9cfcd919548d50bca2b0bc07f787a23d9adaa825b1ead1e8",
      "compile_commands_sha256": "fb64c9dfb130a29b5398f1840d57a79121b79fd98ae7f79ea33f0c9af278ece4"
    }
  ],
  "license_decision": {
    "spdx": "Apache-2.0",
    "status": "RUN_ALLOWED",
    "reason": "License retained, original source unmodified, patch applied only in build"
  },
  "known_limitations": [
    "Plain uint32 primitive only; no int64/float conversion or hidden delta.",
    "Original unsigned-shift UB failure retained; explicit decode patch required.",
    "COUNT vs COMPRESSED_SIZE and timer do not change wire bytes.",
    "Linux x86_64/SSE4.1 only; query/streaming not registered; leak detection disabled."
  ],
  "unsupported_reason_codes": [
    "NON_DECLARED_DTYPE",
    "MULTIVARIATE_NOT_REGISTERED",
    "STREAMING_UNREGISTERED",
    "ISA_UNSUPPORTED"
  ],
  "source_onboarding_id": "v2:source-onboarding:sha256:45cc2ea139d73e52522d6902d60f8f92bcc07517bc1fdc03eb1cceb029ebb9af"
}
