{
  "schema_version": "tscb.source-onboarding.v2",
  "source_artifact_id": "v2:source-artifact:sha256:84d899b8be4348656bcca306d2b543d8acde7e1865f762698ee8ed3dbc33859b",
  "repository": "https://github.com/fast-pack/streamvbyte",
  "commit": "7c472d7d4d63c8bc65a88f310ccfc695a0eaf1ce",
  "dirty": false,
  "submodules": [],
  "implementation_files": [
    "src/streamvbyte_encode.c",
    "src/streamvbyte_decode.c"
  ],
  "public_api_files": [
    "include/streamvbyte.h"
  ],
  "benchmark_files": [
    "tests/perf.c"
  ],
  "test_files": [
    "tests/unit.c",
    "adapters/streamvbyte_modern/tests/run_native_tests.py",
    "adapters/streamvbyte/tests/abi_smoke.c",
    "adapters/streamvbyte/tests/stages_smoke.c",
    "tests/adapters/test_streamvbyte.py",
    "tests/adapters/test_streamvbyte_pipeline.py"
  ],
  "license_files": [
    "adapters/streamvbyte_modern/vendor/streamvbyte/LICENSE",
    "adapters/streamvbyte_modern/vendor/streamvbyte/src/streamvbyte_isadetection.h"
  ],
  "third_party_dependencies": [],
  "object_level_candidates": [
    "P0_PRIMITIVE"
  ],
  "input_contract": {
    "dtype": "<u4",
    "shape": "CONTIGUOUS_VECTOR",
    "ownership": "BORROWED_IMMUTABLE",
    "max_count": 16777216,
    "alignment_bytes": 1,
    "external_padding_bytes": 0
  },
  "output_contract": {
    "kind": "TSCB_MODERN_1234_U32_DESCRIPTOR_COUNT_V1",
    "self_contained": true,
    "capacity_is_not_size": true,
    "descriptor_sha256": true
  },
  "lifecycle_contract": {
    "update": "ONCE",
    "finalize": "MANDATORY_ZERO_BYTES",
    "reset": "MODE_ZERO_ONLY",
    "decoder_padding": "INTERNAL_COPY_PLUS_16",
    "output_bound": "PREFIX + COUNT_U32 + CEIL(WORD_COUNT/4) + 4*WORD_COUNT; descriptor included by Python",
    "return_length": "tscb_buffer_v1.used_bytes is the exact physical output length; capacity is never the length",
    "error_codes": {
      "0": "OK",
      "1": "INVALID_ARGUMENT",
      "2": "UNSUPPORTED",
      "3": "DST_TOO_SMALL",
      "4": "CODEC_ERROR",
      "5": "FINALIZE_REQUIRED",
      "6": "ABI_MISMATCH"
    },
    "encoder_padding": "INTERNAL_BOUND_PLUS_16"
  },
  "stream_components": [
    "descriptor",
    "sha256",
    "count",
    "control_bytes",
    "data_bytes"
  ],
  "upstream_tests": [
    {
      "name": "full upstream unit + bounded ABI/stages + 1234 equivalence",
      "status": "PASS",
      "log_sha256": "f5f1ab6b338f1a5ac159b553424815d9f44bb65b4a4e03e4cd2696c5d08ad6d7",
      "evidence": "build/source-audits/streamvbyte-modern-native-tests.json"
    }
  ],
  "builds": [
    {
      "kind": "release",
      "artifact_sha256": "006fc40e8368fb42954fa9a74f1162eaeb3dc2df1ce82dc3e2d45e1b68fb017c",
      "compile_commands_sha256": "e141261483a6a62c2831fc8646c3cbe07289f7fa090c0afb98dfbfd5dfb535ec"
    },
    {
      "kind": "debug",
      "artifact_sha256": "cd04d8f9d5e407877d05d985662805a7b20a683e8984faa75ea79faf881c2cb7",
      "compile_commands_sha256": "726840e084a2d47a3174e791a6399c43d87ebeaaf72429aa329b0b4eadeb78fc"
    },
    {
      "kind": "sanitizer",
      "artifact_sha256": "4c0203ff6d8c5a67de0008008679a1f8340517786ceb87d354f7a9946ba8da7b",
      "compile_commands_sha256": "2992c80bafc94c106a8242649b8a3352938c9cc97c5c89eda7b542be4a49fe86"
    }
  ],
  "license_decision": {
    "spdx": "Apache-2.0 AND BSD-3-Clause",
    "status": "RUN_ALLOWED",
    "reason": "LICENSE and embedded ISA detection notices preserved"
  },
  "known_limitations": [
    "Frozen modern 1234 SSE4.1 encode/decode with declared scalar tails; no fallback.",
    "Separate source identity from old Benchmark variants.",
    "Full upstream tests include unregistered 0124/delta32/zigzag variants; their testing does not register them.",
    "Original upstream sanitizer fails modular signed ZigZag delta; bounded adapter excludes it; patched tests preserve modular32 arithmetic.",
    "Native API timer excludes count, staging, FFI, descriptor and P2 transforms.",
    "D wrapper is mandatory; A/B/C disabled representations are explicit and independently validated.",
    "Leak detection disabled; Linux x86_64 qualification only.",
    "uint32 UTS only; no implicit int64/float conversion."
  ],
  "unsupported_reason_codes": [
    "NON_DECLARED_DTYPE",
    "STREAMING_UNREGISTERED",
    "ISA_UNSUPPORTED",
    "MULTIVARIATE_NOT_REGISTERED"
  ],
  "source_onboarding_id": "v2:source-onboarding:sha256:a365151a0f30f28154c7f8c6471e3149556db5ca3a8f0ec9b71653d827454ad2"
}
